{
  "id": "train_from_scratch",
  "title": "Train a Model From Scratch",
  "description": "Build a new machine learning model from the ground up using MLX, optimized for Apple Silicon. Ideal for custom use cases and datasets.",
  "notes": "# Training a Model From Scratch\n\n## Overview\nThis recipe demonstrates how to train a new machine learning model from scratch using MLX framework, optimized for Apple Silicon.\n\n## Important Considerations\n- Optimized for Apple Silicon (M1/M2/M3)\n- Uses MLX for efficient training\n- Dataset is formatted for instruction following\n\n## Training Tips\n- Monitor loss curves carefully\n- Adjust batch size based on available memory\n- Use appropriate learning rate schedule\n\n## Expected Outcomes\nAfter training, the model should be able to:\n- Follow basic instructions\n- Generate coherent responses\n- Demonstrate basic language understanding",
  "requiredMachineArchitecture": [
    "mlx"
  ],
  "dependencies": [
    {
      "type": "model",
      "name": "mlx-community/Llama-3.2-1B-Instruct-4bit"
    },
    {
      "type": "plugin",
      "name": "mlx_lora_trainer"
    },
    {
      "type": "dataset",
      "name": "spencer/samsum_reformat"
    },
    {
      "type": "plugin",
      "name": "eleuther-ai-lm-evaluation-harness-mlx"
    }
  ],
  "tasks": [
    {
      "name": "train_from_scratch",
      "task_type": "TRAIN",
      "type": "Training",
      "plugin": "mlx_lora_trainer",
      "config_json": "{\"template_name\":\"TrainFromScratch\",\"plugin_name\":\"mlx_lora_trainer\",\"model_name\":\"mlx-community/Llama-3.2-1B-Instruct-4bit\",\"model_architecture\":\"LlamaForCausalLM\",\"formatting_template\":\"{{text}}\",\"lora_layers\":\"16\",\"batch_size\":\"8\",\"learning_rate\":\"0.0001\",\"lora_rank\":\"32\",\"lora_alpha\":\"128\",\"iters\":\"120\",\"steps_per_report\":\"10\",\"steps_per_eval\":\"20\",\"save_every\":\"10\",\"adaptor\":\"from_scratch\"}"
    },
    {
      "name": "evaluate_model",
      "task_type": "EVAL",
      "plugin": "eleuther-ai-lm-evaluation-harness-mlx",
      "config_json": "{\"template_name\":\"EvalFromScratch\",\"plugin_name\":\"eleuther-ai-lm-evaluation-harness-mlx\",\"model_name\":\"mlx-community/Llama-3.2-1B-Instruct-4bit\",\"model_architecture\":\"MLX\",\"tasks\":\"mmlu\",\"limit\":\"0.5\",\"run_name\":\"EvalFromScratch\"}"
    }
  ],
  "workflows": [
    {
      "name": "Train_and_Evaluate",
      "config": {
        "nodes": [
          {
            "id": "node_train",
            "type": "TRAIN",
            "task": "train_from_scratch",
            "name": "Training Task",
            "out": [
              "node_eval"
            ]
          },
          {
            "id": "node_eval",
            "type": "EVAL",
            "task": "evaluate_model",
            "name": "Evaluation Task",
            "out": []
          }
        ]
      }
    }
  ],
  "cardImage": "https://plus.unsplash.com/premium_photo-1682142051662-eda5ad640633?q=80&w=2071&auto=format&fit=crop&ixlib=rb-4.1.0&ixid=M3wxMjA3fDB8MHxwaG90by1wYWdlfHx8fGVufDB8fHx8fA%3D%3D"
}