{
  "id": "python_code_completion",
  "title": "Python Code Completion",
  "description": "Train a SmolLM Base model to provide intelligent Python code completions, suggestions, and assistance. Ideal for developers looking for an efficient coding assistant.",
  "notes": "# Train SmolLM for Python Code Completion\n\n## Overview\nThis recipe fine-tunes the **SmolLM2-135M** model to become a specialized Python code completion assistant. It uses a comprehensive dataset of Python code examples to help developers with intelligent code suggestions, completions, and programming assistance.\n\nTo get started, simply go to the **Training** page and click **Queue** \u2014 the training process is ready to run.\n\n## Training Process\nThis recipe performs LoRA fine-tuning on the SmolLM model using:\n\n1. **Model**: HuggingFaceTB/SmolLM2-135M (efficient 135M parameter model)\n2. **Dataset**: Python-Codes-25k containing diverse Python programming examples and patterns\n3. **Training Method**: LoRA fine-tuning optimized for code completion tasks\n4. **Focus**: Context-aware Python code understanding and generation\n\n## How to Use the Fine-Tuned Model\nOnce the training is complete, you can interact with the updated model directly:\n\n1. Go to the **Foundation** tab  \n2. Look for the model titled:  \n   `SmolLM2-135M_python`  \n3. Click **Run**  \n4. Navigate to the **Interact** tab to start chatting\n\nYou can now provide partial Python code or describe programming tasks, and the model will suggest appropriate completions and solutions.\n\n## Important Notes\n- This recipe uses a **very efficient 135M parameter model** ideal for fast code completion\n- Optimized for **CUDA and AMD GPU** architectures\n- High LoRA rank (64) ensures strong adaptation to Python programming patterns\n- The model learns from 25k diverse Python code examples\n\n## Expected Outcomes\nAfter completing this recipe, your model should be able to:\n- Provide intelligent, context-aware Python code completions\n- Suggest appropriate Python syntax and best practices\n- Complete common programming patterns and functions\n- Assist with Python development tasks and problem-solving\n- Generate relevant code snippets based on natural language descriptions",
  "requiredMachineArchitecture": [
    "cuda",
    "amd"
  ],
  "dependencies": [
    {
      "type": "model",
      "name": "HuggingFaceTB/SmolLM2-135M"
    },
    {
      "type": "dataset",
      "name": "flytech/python-codes-25k"
    },
    {
      "type": "plugin",
      "name": "llama_trainer"
    }
  ],
  "tasks": [
    {
      "name": "train_smollm_python_completion",
      "task_type": "TRAIN",
      "type": "LoRA",
      "plugin": "llama_trainer",
      "formatting_template": "{{output}}",
      "config_json": "{\"template_name\":\"PythonCompletion\",\"plugin_name\":\"llama_trainer\",\"model_name\":\"HuggingFaceTB/SmolLM2-135M\",\"model_architecture\":\"LlamaForCausalLM\",\"formatting_template\":\"{{output}}\\n\",\"dataset_name\":\"flytech/python-codes-25k\",\"maximum_sequence_length\":\"2048\",\"batch_size\":\"4\",\"learning_rate\":\"0.0005\",\"num_train_epochs\":\"1\",\"max_steps\":\"-1\",\"lora_r\":\"64\",\"lora_alpha\":\"128\",\"lora_dropout\":\"0.05\",\"adaptor_name\":\"python\",\"_tlab_recipe_datasets\":{\"name\":\"flytech/python-codes-25k\",\"path\":\"flytech/python-codes-25k\"},\"_tlab_recipe_models\":{\"name\":\"HuggingFaceTB/SmolLM2-135M\",\"path\":\"HuggingFaceTB/SmolLM2-135M\"}}"
    }
  ],
  "workflows": [],
  "cardImage": "https://images.unsplash.com/photo-1515879218367-8466d910aaa4?q=80&w=2069&auto=format&fit=crop&ixlib=rb-4.1.0&ixid=M3wxMjA3fDB8MHxwaG90by1wYWdlfHx8fGVufDB8fHx8fA%3D%3D"
}